{
  "schema_version": "1.0.0",
  "artifact_type": "technical_snapshot",
  "artifact_id": "technical-snapshot:KHC:2026-08-03",
  "owner_type": "generated",
  "ticker": "KHC",
  "as_of_date": "2026-08-03",
  "generated_at": "2026-08-03T23:59:59Z",
  "engine_version": "1.0.0",
  "indicators": {
    "sma_50": {
      "status": "available",
      "value": "24.36431751251220712"
    },
    "sma_200": {
      "status": "available",
      "value": "23.371163148880004925"
    },
    "price_vs_sma_50": {
      "status": "available",
      "value": "above"
    },
    "price_vs_sma_200": {
      "status": "available",
      "value": "above"
    },
    "sma_50_vs_sma_200": {
      "status": "available",
      "value": "above"
    },
    "rsi_14": {
      "status": "available",
      "value": "53.49558072982764329297633521"
    },
    "avg_volume_20d": {
      "status": "available",
      "value": "12923890"
    },
    "avg_volume_60d": {
      "status": "available",
      "value": "14200496.66666666666666666667"
    },
    "volume_trend": {
      "status": "available",
      "value": "yatay"
    },
    "support_63d": {
      "status": "available",
      "value": "22.0049991607666"
    },
    "resistance_63d": {
      "status": "available",
      "value": "28.09000015258789"
    }
  },
  "provenance": {
    "price_series_length": 274,
    "lookback_start_date": "2025-06-29",
    "lookback_end_date": "2026-08-03",
    "price_field_used": "adjusted_close",
    "yfinance_ticker": "KHC"
  }
}
