{
  "schema_version": "1.0.0",
  "artifact_type": "technical_snapshot",
  "artifact_id": "technical-snapshot:KDP:2026-08-03",
  "owner_type": "generated",
  "ticker": "KDP",
  "as_of_date": "2026-08-03",
  "generated_at": "2026-08-04T06:28:11Z",
  "engine_version": "1.0.0",
  "indicators": {
    "sma_50": {
      "status": "available",
      "value": "30.86125404357910166"
    },
    "sma_200": {
      "status": "available",
      "value": "28.250586071014404305"
    },
    "price_vs_sma_50": {
      "status": "unavailable",
      "reason_codes": [
        {
          "code": "technical.indicator_dependency_unavailable",
          "severity": "warning"
        }
      ]
    },
    "price_vs_sma_200": {
      "status": "unavailable",
      "reason_codes": [
        {
          "code": "technical.indicator_dependency_unavailable",
          "severity": "warning"
        }
      ]
    },
    "sma_50_vs_sma_200": {
      "status": "available",
      "value": "above"
    },
    "rsi_14": {
      "status": "available",
      "value": "51.99321661838691144412249869"
    },
    "avg_volume_20d": {
      "status": "available",
      "value": "12179344.9"
    },
    "avg_volume_60d": {
      "status": "available",
      "value": "13596869.96666666666666666667"
    },
    "volume_trend": {
      "status": "available",
      "value": "azalıyor"
    },
    "support_63d": {
      "status": "available",
      "value": "27.84000015258789"
    },
    "resistance_63d": {
      "status": "available",
      "value": "33.81999969482422"
    }
  },
  "provenance": {
    "price_series_length": 275,
    "lookback_start_date": "2025-06-29",
    "lookback_end_date": "2026-08-03",
    "price_field_used": "adjusted_close",
    "yfinance_ticker": "KDP"
  }
}
